{
  "$schema": "../../schemas/v1/operation.schema.json",
  "id": "cups",
  "title": "CUPS",
  "description": "Linutil-inspired CUPS operation definition.",
  "kind": "utility",
  "state": "draft",
  "distro": "any-linux",
  "platforms": [
    "linux"
  ],
  "categories": [
    "utility",
    "printing"
  ],
  "tags": [
    "linutil-derived"
  ],
  "dependencies": [],
  "actions": [
    {
      "id": "cups.apply",
      "phase": "configure",
      "executor": "apt",
      "run": [
        "cups"
      ]
    }
  ],
  "validation": [
    {
      "id": "cups.validation",
      "check": [
        "systemctl",
        "is-enabled",
        "cups"
      ],
      "expected": "CUPS is applied or available",
      "required": false
    }
  ],
  "links": [
    "https://linutil.christitus.com/userguide/features/",
    "https://linutil.christitus.com/userguide/tweaks/"
  ]
}
