{
  "$schema": "../../schemas/v1/operation.schema.json",
  "id": "change-orientation",
  "title": "Change Orientation",
  "description": "Linutil-inspired Change Orientation operation definition.",
  "kind": "utility",
  "state": "draft",
  "distro": "any-linux",
  "platforms": [
    "linux"
  ],
  "categories": [
    "utility",
    "display"
  ],
  "tags": [
    "linutil-derived"
  ],
  "dependencies": [],
  "actions": [
    {
      "id": "change-orientation.apply",
      "phase": "configure",
      "executor": "shell",
      "run": [
        "set-display-orientation"
      ]
    }
  ],
  "validation": [
    {
      "id": "change-orientation.validation",
      "check": [
        "display-orientation",
        "--check"
      ],
      "expected": "Change Orientation is applied or available",
      "required": false
    }
  ],
  "links": [
    "https://linutil.christitus.com/userguide/features/",
    "https://linutil.christitus.com/userguide/tweaks/"
  ]
}
