{
  "$schema": "../../schemas/v1/operation.schema.json",
  "id": "bluetooth-manager",
  "title": "Bluetooth Manager",
  "description": "Linutil-inspired Bluetooth Manager operation definition.",
  "kind": "utility",
  "state": "draft",
  "distro": "any-linux",
  "platforms": [
    "linux"
  ],
  "categories": [
    "utility",
    "connectivity"
  ],
  "tags": [
    "linutil-derived"
  ],
  "dependencies": [],
  "actions": [
    {
      "id": "bluetooth-manager.apply",
      "phase": "configure",
      "executor": "shell",
      "run": [
        "manage-bluetooth"
      ]
    }
  ],
  "validation": [
    {
      "id": "bluetooth-manager.validation",
      "check": [
        "bluetoothctl",
        "show"
      ],
      "expected": "Bluetooth Manager is applied or available",
      "required": false
    }
  ],
  "links": [
    "https://linutil.christitus.com/userguide/features/",
    "https://linutil.christitus.com/userguide/tweaks/"
  ]
}
