{
  "$schema": "../../schemas/v1/operation.schema.json",
  "id": "scale-monitors",
  "title": "Scale Monitors",
  "description": "Linutil-inspired Scale Monitors operation definition.",
  "kind": "utility",
  "state": "draft",
  "distro": "any-linux",
  "platforms": [
    "linux"
  ],
  "categories": [
    "utility",
    "display"
  ],
  "tags": [
    "linutil-derived"
  ],
  "dependencies": [],
  "actions": [
    {
      "id": "scale-monitors.apply",
      "phase": "configure",
      "executor": "shell",
      "run": [
        "set-display-scale"
      ]
    }
  ],
  "validation": [
    {
      "id": "scale-monitors.validation",
      "check": [
        "display-scale",
        "--check"
      ],
      "expected": "Scale Monitors is applied or available",
      "required": false
    }
  ],
  "links": [
    "https://linutil.christitus.com/userguide/features/",
    "https://linutil.christitus.com/userguide/tweaks/"
  ]
}
