{
  "$schema": "../../../schemas/v1/operation.schema.json",
  "id": "full-system-update",
  "title": "Full System Update",
  "description": "Linutil-inspired Full System Update operation definition.",
  "kind": "tweak",
  "state": "draft",
  "distro": "ubuntu",
  "platforms": [
    "linux"
  ],
  "categories": [
    "tweak",
    "maintenance"
  ],
  "tags": [
    "linutil-derived"
  ],
  "dependencies": [],
  "actions": [
    {
      "id": "full-system-update.apply",
      "phase": "configure",
      "executor": "apt",
      "run": [
        "apt-get",
        "update"
      ]
    }
  ],
  "validation": [
    {
      "id": "full-system-update.validation",
      "check": [
        "apt-get",
        "-s",
        "upgrade"
      ],
      "expected": "Full System Update is applied or available",
      "required": false
    }
  ],
  "links": [
    "https://linutil.christitus.com/userguide/features/",
    "https://linutil.christitus.com/userguide/tweaks/"
  ]
}
